<?xml version="1.0" encoding="utf-8"?>
<!DOCTYPE module SYSTEM "api.dtd">

<module name="pygame2.sdl.audio">
  <short>SDL audio subsystem wrapper</short>
  <desc>Pygame SDL audio subsystem wrapper module.

    .. note::

      Do not use :mod:`pygame2.sdlmixer` and :mod:`pygame2.sdl.audio` at the
      same time. As they both deal with audio hardware access, this can lead
      to problems and weird behaviour.
  </desc>

  <func name="init">
    <call>init () -> None</call>
    <desc>
      Initializes the audio subsystem of the SDL library.
    </desc>
  </func>
  <func name="quit">
    <call>quit () -> None</call>
    <desc>
      Shuts down the audio subsystem of the SDL library.

      After calling this function, you should not invoke any class,
      method or function related to the audio subsystem as they are
      likely to fail or might give unpredictable results.
    </desc>
  </func>
  <func name="was_init">
    <call>was_init () -> bool</call>
    <desc>
      Returns, whether the audio subsystem of the SDL library is initialized.
    </desc>
  </func>
</module>

