<?xml version="1.0" encoding="utf-8"?>
<!DOCTYPE module SYSTEM "api.dtd">

<module name="pygame2.sdlext.scrap">
  <short>OS clipboard access for SDL</short>
  <desc></desc>

  <func name="contains">
    <call></call>
    <desc></desc>
  </func>
  <func name="get">
    <call></call>
    <desc></desc>
  </func>
  <func name="get_mode">
    <call></call>
    <desc></desc>
  </func>
  <func name="get_types">
    <call></call>
    <desc></desc>
  </func>
  <func name="init">
    <call></call>
    <desc></desc>
  </func>
  <func name="lost">
    <call></call>
    <desc></desc>
  </func>
  <func name="put">
    <call></call>
    <desc></desc>
  </func>
  <func name="quit">
    <call></call>
    <desc></desc>
  </func>
  <func name="set_mode">
    <call></call>
    <desc></desc>
  </func>
  <func name="was_init">
    <call></call>
    <desc></desc>
  </func>
</module>

